{"componentChunkName":"component---src-components-layout-tsx","path":"/fr/","result":{"data":{"mdx":{"id":"62404e44-e998-51be-a64c-0c333719b041","body":"function _extends() { _extends = Object.assign || function (target) { for (var i = 1; i < arguments.length; i++) { var source = arguments[i]; for (var key in source) { if (Object.prototype.hasOwnProperty.call(source, key)) { target[key] = source[key]; } } } return target; }; return _extends.apply(this, arguments); }\n\nfunction _objectWithoutProperties(source, excluded) { if (source == null) return {}; var target = _objectWithoutPropertiesLoose(source, excluded); var key, i; if (Object.getOwnPropertySymbols) { var sourceSymbolKeys = Object.getOwnPropertySymbols(source); for (i = 0; i < sourceSymbolKeys.length; i++) { key = sourceSymbolKeys[i]; if (excluded.indexOf(key) >= 0) continue; if (!Object.prototype.propertyIsEnumerable.call(source, key)) continue; target[key] = source[key]; } } return target; }\n\nfunction _objectWithoutPropertiesLoose(source, excluded) { if (source == null) return {}; var target = {}; var sourceKeys = Object.keys(source); var key, i; for (i = 0; i < sourceKeys.length; i++) { key = sourceKeys[i]; if (excluded.indexOf(key) >= 0) continue; target[key] = source[key]; } return target; }\n\n/* @jsxRuntime classic */\n\n/* @jsx mdx */\nvar _frontmatter = {\n  \"title\": \"Accueil\",\n  \"hero\": {\n    \"title\": \"Internet a besoin de super-héros.\",\n    \"description\": \"Exorde est une communauté dédiée à la lutte contre la désinformation en ligne.\",\n    \"waitlistButton\": \"Me tenir informé\"\n  },\n  \"video\": {\n    \"url\": \"https://www.youtube-nocookie.com/embed/cSKGa_7XJkg?controls=0&hl=fr&cc_lang_pref=fr&cc_load_policy=1\",\n    \"title\": \"Notre ennemi ? La propagation de fausses informations.\",\n    \"description\": \"Lorem ipsum dolor sit amet, consectetur adipiscing elit. Praesent lorem risus, auctor vel tellus eget, maximus volutpat lorem.\"\n  },\n  \"showcase\": {\n    \"title\": \"Préparez-vous, Exorde arrive.\",\n    \"products\": [{\n      \"title\": \"Exorde shield\",\n      \"description\": \"Une extension de navigateur gratuite et open-source qui affichera un indicateur de fiabilité pour chaque information que vous rencontrerez sur internet.\",\n      \"image\": \"../images/shield.svg\"\n    }, {\n      \"title\": \"Exorde power\",\n      \"description\": \"Une plateforme collaborative gratuite et open-source, dans laquelle vous réalisez diverses tâches et en étant récompensé pour votre contribution.\",\n      \"image\": \"../images/thunderbolt.svg\"\n    }]\n  },\n  \"concept\": {\n    \"title\": \"Comprendre Exorde en une minute.\",\n    \"steps\": [{\n      \"description\": \"Il est difficile, lorsque l'on navigue sur internet, de savoir si ce que nous lisons est fiable. Exorde a pour but de vous aider à naviguer sereinement.\",\n      \"image\": \"../images/exorde-context.svg\"\n    }, {\n      \"description\": \"La plateforme Exorde rassemblera toute une communauté qui parcourra le web et ses informations. Accessible gratuitement par tous à travers un site web, il vous suffira de créer un compte pour y accéder. Vous aurez alors différentes tâches à réaliser pour trouver, classer et lier les informations du web et permettre au système Exorde de détecter les fake news.\",\n      \"image\": \"../images/exorde-platform.svg\"\n    }, {\n      \"description\": \"Pour chaque contribution et lorsqu'il y aura consensus entre les différents collaborateurs, vous gagnerez de l'EXD, la crypto-monnaie d'Exorde. Vous pourrez ensuite l'échanger contre des euros, dollars, ethereum, bitcoin, etc.\",\n      \"image\": \"../images/exorde-money.svg\"\n    }, {\n      \"description\": \"Les informations entrées sur la plateforme se retrouveront ensuite sur l'extension de navigateur Exorde. Accessible sans inscription, cette extension vous permettra d'afficher un indicateur de fiabilité sur la page que vous visitez et vous indiquera les autres sites contenant des informations similaires.\",\n      \"image\": \"../images/exorde-extension.svg\"\n    }]\n  },\n  \"whitepaper\": {\n    \"title\": \"Livre blanc\",\n    \"description\": \"Lorem ipsum dolor sit amet, consectetur adipiscing elit. Praesent lorem risus, auctor veltellus eget, maximus volutpat lorem.\",\n    \"file\": \"../pdf/whitepaper.pdf\",\n    \"pdfButton\": {\n      \"label\": \"Format pdf\"\n    }\n  },\n  \"newsletter\": {\n    \"title\": \"Newsletter\",\n    \"description\": \"Lorem ipsum dolor sit amet, consectetur adipiscing elit. Praesent lorem risus, auctor veltellus eget, maximus volutpat lorem.\",\n    \"form\": {\n      \"firstNameLabel\": \"Prénom\",\n      \"emailLabel\": \"Email\",\n      \"buttonLabel\": \"Souscrire\"\n    }\n  }\n};\nvar layoutProps = {\n  _frontmatter: _frontmatter\n};\nvar MDXLayout = \"wrapper\";\nreturn function MDXContent(_ref) {\n  var components = _ref.components,\n      props = _objectWithoutProperties(_ref, [\"components\"]);\n\n  return mdx(MDXLayout, _extends({}, layoutProps, props, {\n    components: components,\n    mdxType: \"MDXLayout\"\n  }), mdx(Hero, {\n    content: props.frontmatter.hero,\n    mdxType: \"Hero\"\n  }), mdx(Video, {\n    content: props.frontmatter.video,\n    mdxType: \"Video\"\n  }), mdx(Concept, {\n    title: props.frontmatter.concept.title,\n    steps: props.frontmatter.concept.steps,\n    mdxType: \"Concept\"\n  }), mdx(Products, {\n    title: props.frontmatter.showcase.title,\n    products: props.frontmatter.showcase.products,\n    mdxType: \"Products\"\n  }), mdx(Whitepaper, {\n    title: props.frontmatter.whitepaper.title,\n    description: props.frontmatter.whitepaper.description,\n    file: props.frontmatter.whitepaper.file,\n    pdfButton: props.frontmatter.whitepaper.pdfButton,\n    mdxType: \"Whitepaper\"\n  }), mdx(Newsletter, {\n    title: props.frontmatter.newsletter.title,\n    description: props.frontmatter.newsletter.description,\n    form: props.frontmatter.newsletter.form,\n    mdxType: \"Newsletter\"\n  }));\n}\n;\nMDXContent.isMDXComponent = true;","frontmatter":{"hero":{"title":"Internet a besoin de super-héros.","description":"Exorde est une communauté dédiée à la lutte contre la désinformation en ligne.","waitlistButton":"Me tenir informé"},"video":{"title":"Notre ennemi ? La propagation de fausses informations.","description":"Lorem ipsum dolor sit amet, consectetur adipiscing elit. Praesent lorem risus, auctor vel tellus eget, maximus volutpat lorem.","url":"https://www.youtube-nocookie.com/embed/cSKGa_7XJkg?controls=0&hl=fr&cc_lang_pref=fr&cc_load_policy=1"},"showcase":{"title":"Préparez-vous, Exorde arrive.","products":[{"title":"Exorde shield","description":"Une extension de navigateur gratuite et open-source qui affichera un indicateur de fiabilité pour chaque information que vous rencontrerez sur internet.","image":{"publicURL":"/static/f95a2e57386be32ae10f459cee7dd0df/shield.svg"}},{"title":"Exorde power","description":"Une plateforme collaborative gratuite et open-source, dans laquelle vous réalisez diverses tâches et en étant récompensé pour votre contribution.","image":{"publicURL":"/static/9dd4f09accbbb6bf80598ce1279977c8/thunderbolt.svg"}}]},"concept":{"title":"Comprendre Exorde en une minute.","steps":[{"description":"Il est difficile, lorsque l'on navigue sur internet, de savoir si ce que nous lisons est fiable. Exorde a pour but de vous aider à naviguer sereinement.","image":{"publicURL":"/static/2f5225f1ecf2ddf8d73bb7c22337de56/exorde-context.svg"}},{"description":"La plateforme Exorde rassemblera toute une communauté qui parcourra le web et ses informations. Accessible gratuitement par tous à travers un site web, il vous suffira de créer un compte pour y accéder. Vous aurez alors différentes tâches à réaliser pour trouver, classer et lier les informations du web et permettre au système Exorde de détecter les fake news.","image":{"publicURL":"/static/e4433ba86e5eaed0975a3806b243ddd2/exorde-platform.svg"}},{"description":"Pour chaque contribution et lorsqu'il y aura consensus entre les différents collaborateurs, vous gagnerez de l'EXD, la crypto-monnaie d'Exorde. Vous pourrez ensuite l'échanger contre des euros, dollars, ethereum, bitcoin, etc.","image":{"publicURL":"/static/8307cbac64566b8303b8ce0cf6e5e7f1/exorde-money.svg"}},{"description":"Les informations entrées sur la plateforme se retrouveront ensuite sur l'extension de navigateur Exorde. Accessible sans inscription, cette extension vous permettra d'afficher un indicateur de fiabilité sur la page que vous visitez et vous indiquera les autres sites contenant des informations similaires.","image":{"publicURL":"/static/1ea828e927e5cda99241dfe891e6bb0f/exorde-extension.svg"}}]},"whitepaper":{"title":"Livre blanc","description":"Lorem ipsum dolor sit amet, consectetur adipiscing elit. Praesent lorem risus, auctor veltellus eget, maximus volutpat lorem.","file":{"publicURL":"/static/27745e1b820d4263f8ca8cfac401a343/whitepaper.pdf"},"pdfButton":{"label":"Format pdf"}},"newsletter":{"title":"Newsletter","description":"Lorem ipsum dolor sit amet, consectetur adipiscing elit. Praesent lorem risus, auctor veltellus eget, maximus volutpat lorem.","form":{"firstNameLabel":"Prénom","emailLabel":"Email","buttonLabel":"Souscrire"}}}}},"pageContext":{"id":"62404e44-e998-51be-a64c-0c333719b041","locale":"fr"}},"staticQueryHashes":[]}