{"componentChunkName":"component---src-components-layout-tsx","path":"/en/","result":{"data":{"mdx":{"id":"63bbc44f-caf4-532a-b433-11c38f40d022","body":"function _extends() { _extends = Object.assign || function (target) { for (var i = 1; i < arguments.length; i++) { var source = arguments[i]; for (var key in source) { if (Object.prototype.hasOwnProperty.call(source, key)) { target[key] = source[key]; } } } return target; }; return _extends.apply(this, arguments); }\n\nfunction _objectWithoutProperties(source, excluded) { if (source == null) return {}; var target = _objectWithoutPropertiesLoose(source, excluded); var key, i; if (Object.getOwnPropertySymbols) { var sourceSymbolKeys = Object.getOwnPropertySymbols(source); for (i = 0; i < sourceSymbolKeys.length; i++) { key = sourceSymbolKeys[i]; if (excluded.indexOf(key) >= 0) continue; if (!Object.prototype.propertyIsEnumerable.call(source, key)) continue; target[key] = source[key]; } } return target; }\n\nfunction _objectWithoutPropertiesLoose(source, excluded) { if (source == null) return {}; var target = {}; var sourceKeys = Object.keys(source); var key, i; for (i = 0; i < sourceKeys.length; i++) { key = sourceKeys[i]; if (excluded.indexOf(key) >= 0) continue; target[key] = source[key]; } return target; }\n\n/* @jsxRuntime classic */\n\n/* @jsx mdx */\nvar _frontmatter = {\n  \"title\": \"Homepage\",\n  \"hero\": {\n    \"title\": \"The Internet needs superheroes.\",\n    \"description\": \"Exorde is people helping people fight against misinformation.\"\n  },\n  \"video\": {\n    \"url\": \"https://www.youtube-nocookie.com/embed/cSKGa_7XJkg?controls=0\",\n    \"title\": \"Our enemy ? Fake news propagation.\",\n    \"description\": \"In recent years, a great deal of attention has been devoted to the rise in fake news: everything from satire and misleading content to articles that are completely fabricated. When any type of content (image, news, video, audio, …) makes it on the web, it can spread anywhere in a matter of seconds, without any original context, for any purpose. Any authentic content (or not) can be reused to create viral fake information to manipulate the public opinion on a given subject in the short term or hurt the reputation of any entity (organizations, personas, etc).\"\n  },\n  \"showcase\": {\n    \"title\": \"Brace yourselves, Exorde is coming.\",\n    \"products\": [{\n      \"title\": \"Exorde shield\",\n      \"description\": \"A free open-source browser extension that displays a trust score for every information you encounter on the Internet.\",\n      \"image\": \"../images/shield.svg\"\n    }, {\n      \"title\": \"Exorde power\",\n      \"description\": \"A free open-source collaborative platform where you do some tasks, and you receive payment in exchange for your efforts.\",\n      \"image\": \"../images/thunderbolt.svg\"\n    }]\n  },\n  \"concept\": {\n    \"title\": \"Understand Exorde in a minute.\",\n    \"steps\": [{\n      \"description\": \"Il est difficile, lorsque l'on navigue sur internet, de savoir si ce que nous lisons est fiable. Exorde a pour but de vous aider à naviguer sereinement.\",\n      \"image\": \"../images/exorde-context.svg\"\n    }, {\n      \"description\": \"La plateforme Exorde rassemble toute une communauté qui va parcourir le web et réaliser différentes tâches avec les informations qui le composent.\",\n      \"image\": \"../images/exorde-platform.svg\"\n    }, {\n      \"description\": \"Pour chaque contribution et lorsqu'il y a consensus entre les différents collaborateurs, vous gagnez de l'EXD, la crypto-monnaie d'Exorde. Vous pourrez ensuite l'échanger contre des euros, dollars, ethereum, bitcoin, etc.\",\n      \"image\": \"../images/exorde-money.svg\"\n    }, {\n      \"description\": \"Les informations entrées sur la plateforme se retrouvent ensuite sur l'extension de navigateur Exorde. Accessible sans inscription, cette extension vous permet d'afficher un indicateur de fiabilité sur la page que vous visitez et vous indique les autres sites contenant des informations similaires.\",\n      \"image\": \"../images/exorde-extension.svg\"\n    }]\n  },\n  \"whitepaper\": {\n    \"title\": \"Whitepaper\",\n    \"description\": \"Lorem ipsum dolor sit amet, consectetur adipiscing elit. Praesent lorem risus, auctor veltellus eget, maximus volutpat lorem.\",\n    \"file\": \"../pdf/whitepaper.pdf\",\n    \"pdfButton\": {\n      \"label\": \"Pdf version\"\n    }\n  },\n  \"newsletter\": {\n    \"title\": \"Newsletter\",\n    \"description\": \"Lorem ipsum dolor sit amet, consectetur adipiscing elit. Praesent lorem risus, auctor veltellus eget, maximus volutpat lorem.\",\n    \"form\": {\n      \"firstNameLabel\": \"First name\",\n      \"emailLabel\": \"Email\",\n      \"buttonLabel\": \"Suscribe\"\n    }\n  }\n};\nvar layoutProps = {\n  _frontmatter: _frontmatter\n};\nvar MDXLayout = \"wrapper\";\nreturn function MDXContent(_ref) {\n  var components = _ref.components,\n      props = _objectWithoutProperties(_ref, [\"components\"]);\n\n  return mdx(MDXLayout, _extends({}, layoutProps, props, {\n    components: components,\n    mdxType: \"MDXLayout\"\n  }), mdx(Hero, {\n    content: props.frontmatter.hero,\n    mdxType: \"Hero\"\n  }), mdx(Video, {\n    content: props.frontmatter.video,\n    mdxType: \"Video\"\n  }), mdx(Concept, {\n    title: props.frontmatter.concept.title,\n    steps: props.frontmatter.concept.steps,\n    mdxType: \"Concept\"\n  }), mdx(Products, {\n    title: props.frontmatter.showcase.title,\n    products: props.frontmatter.showcase.products,\n    mdxType: \"Products\"\n  }), mdx(Whitepaper, {\n    title: props.frontmatter.whitepaper.title,\n    description: props.frontmatter.whitepaper.description,\n    file: props.frontmatter.whitepaper.file,\n    pdfButton: props.frontmatter.whitepaper.pdfButton,\n    mdxType: \"Whitepaper\"\n  }), mdx(Newsletter, {\n    title: props.frontmatter.newsletter.title,\n    description: props.frontmatter.newsletter.description,\n    form: props.frontmatter.newsletter.form,\n    mdxType: \"Newsletter\"\n  }));\n}\n;\nMDXContent.isMDXComponent = true;","frontmatter":{"hero":{"title":"The Internet needs superheroes.","description":"Exorde is people helping people fight against misinformation."},"video":{"title":"Our enemy ? Fake news propagation.","description":"In recent years, a great deal of attention has been devoted to the rise in fake news: everything from satire and misleading content to articles that are completely fabricated. When any type of content (image, news, video, audio, …) makes it on the web, it can spread anywhere in a matter of seconds, without any original context, for any purpose. Any authentic content (or not) can be reused to create viral fake information to manipulate the public opinion on a given subject in the short term or hurt the reputation of any entity (organizations, personas, etc).","url":"https://www.youtube-nocookie.com/embed/cSKGa_7XJkg?controls=0"},"showcase":{"title":"Brace yourselves, Exorde is coming.","products":[{"title":"Exorde shield","description":"A free open-source browser extension that displays a trust score for every information you encounter on the Internet.","image":{"publicURL":"/static/f95a2e57386be32ae10f459cee7dd0df/shield.svg"}},{"title":"Exorde power","description":"A free open-source collaborative platform where you do some tasks, and you receive payment in exchange for your efforts.","image":{"publicURL":"/static/9dd4f09accbbb6bf80598ce1279977c8/thunderbolt.svg"}}]},"concept":{"title":"Understand Exorde in a minute.","steps":[{"description":"Il est difficile, lorsque l'on navigue sur internet, de savoir si ce que nous lisons est fiable. Exorde a pour but de vous aider à naviguer sereinement.","image":{"publicURL":"/static/2f5225f1ecf2ddf8d73bb7c22337de56/exorde-context.svg"}},{"description":"La plateforme Exorde rassemble toute une communauté qui va parcourir le web et réaliser différentes tâches avec les informations qui le composent.","image":{"publicURL":"/static/e4433ba86e5eaed0975a3806b243ddd2/exorde-platform.svg"}},{"description":"Pour chaque contribution et lorsqu'il y a consensus entre les différents collaborateurs, vous gagnez de l'EXD, la crypto-monnaie d'Exorde. Vous pourrez ensuite l'échanger contre des euros, dollars, ethereum, bitcoin, etc.","image":{"publicURL":"/static/8307cbac64566b8303b8ce0cf6e5e7f1/exorde-money.svg"}},{"description":"Les informations entrées sur la plateforme se retrouvent ensuite sur l'extension de navigateur Exorde. Accessible sans inscription, cette extension vous permet d'afficher un indicateur de fiabilité sur la page que vous visitez et vous indique les autres sites contenant des informations similaires.","image":{"publicURL":"/static/1ea828e927e5cda99241dfe891e6bb0f/exorde-extension.svg"}}]},"whitepaper":{"title":"Whitepaper","description":"Lorem ipsum dolor sit amet, consectetur adipiscing elit. Praesent lorem risus, auctor veltellus eget, maximus volutpat lorem.","file":{"publicURL":"/static/27745e1b820d4263f8ca8cfac401a343/whitepaper.pdf"},"pdfButton":{"label":"Pdf version"}},"newsletter":{"title":"Newsletter","description":"Lorem ipsum dolor sit amet, consectetur adipiscing elit. Praesent lorem risus, auctor veltellus eget, maximus volutpat lorem.","form":{"firstNameLabel":"First name","emailLabel":"Email","buttonLabel":"Suscribe"}}}}},"pageContext":{"id":"63bbc44f-caf4-532a-b433-11c38f40d022","locale":"en"}},"staticQueryHashes":[]}